的,de,"possessive, adjectival suffix",8
在,zài,"be at, in, on; consist in, rest",6
有,yǒu,"have, own, possess; exist",6
这,zhè,"this, the, here",7
们,men,adjunct pronoun indicate plural,5
来,lái,"come, coming; return, returning",7
为,wèi,"do, handle, govern, act; be",4
和,hé,"harmony, peace; peaceful, calm",8
地,de,"earth; soil, ground; region",6
到,dào,"go to, arrive, been to",8
以,yǐ,"by means of; thereby, therefore; consider as; in order to",4
说,shuō,"speak, say, talk; scold, upbraid",9
时,shí,"time, season; era, age, period",7
就,jiù,"just, simply; to come, go to; to approach, near",12
出,chū,"go out, send out; stand; produce",5
会,huì,"assemble, meet together; meeting",6
可,kě,"may, can, -able; possibly",5
对,duì,"correct, right; facing, opposed",5
生,shēng,"life, living, lifetime; birth",5
能,néng,"to be able; can, permitted to; ability",10
而,ér,and; and then; and yet; but,6
得,dé,"obtain, get, gain, acquire",11
于,yú,"in, on, at; go to; surname",3
着,zhe,"make move, take action",11
下,xià,"under, underneath, below; down; inferior; bring down",3
自,zì,"self, private, personal; from",6
之,zhī,"marks preceding phrase as modifier of following phrase; it, him her, them; go to",3
过,guò,"pass, pass through, go across",6
发,fā,"issue, dispatch, send out; hair",5
后,hòu,"queen, empress, sovereign; (simp. for ",6
作,zuò,"make; work; compose, write; act, perform",7
里,lǐ,unit of distance; village; lane,7
用,yòng,"use, employ, apply, operate; use",5
道,dào,"path, road, street; method, way",12
行,xíng,"go; walk; move, travel; circulate",6
所,suǒ,"place, location; numerary adjunct",8
然,rán,"yes, certainly; pledge, promise",12
家,jiā,"house, home, residence; family",10
种,zhǒng,"seed; race, breed; to plant",9
事,shì,"affair, matter, business; to serve; accident, incident",8
成,chéng,"completed, finished, fixed",6
经,jīng,classic works; pass through,8
么,me,interrogative particle; repetition of a tune small; tender,3
去,qù,"go away, leave, depart",5
法,fǎ,"law, rule, regulation, statute; France, French",8
学,xué,"learning, knowledge; school",8
如,rú,"if, supposing; as if; like, as",6
都,dōu,"metropolis, capital; all, the whole; elegant, refined",10
同,tóng,"same, similar; together with",6
当,dāng,"bear, accept, undertake; just",6
没,méi,"not, have not, none; drown, sink",7
动,dòng,"move, happen; movement, action",6
面,miàn,"face; surface; plane; side, dimension",9
起,qǐ,"rise, stand up; go up; begin",10
看,kàn,"look, see; examine, scrutinize",9
定,dìng,"decide, settle, fix",8
天,tiān,"sky, heaven; god, celestial",4
分,fēn,divide; small unit of time etc.,4
还,hái,"still, yet, also, besides",7
进,jìn,"advance, make progress, enter",7
好,hǎo,"good, excellent, fine; well",6
部,bù,"part, division, section",10
其,qí,"his, her, its, their; that",8
些,xiē,"little, few; rather, somewhat",8
主,zhǔ,"master, chief owner; host; lord",5
样,yàng,"shape, form, pattern, style",10
理,lǐ,"reason, logic; manage",11
前,qián,"in front, forward; preceding",9
开,kāi,"open; initiate, begin, start",4
但,dàn,"only; but, however, yet, still",7
因,yīn,"cause, reason; by; because (of)",6
只,zhǐ,"only, just, simply",5
从,cóng,"from, by, since, whence, through",4
想,xiǎng,"think, speculate, plan, consider",13
实,shí,"real, true; honest, sincere",8
的,de,"possessive, adjectival suffix",8
在,zài,"be at, in, on; consist in, rest",6
有,yǒu,"have, own, possess; exist",6
我,wǒ,"our, us, i, me, my, we",7
他,tā,"other, another; he, she, it",5
这,zhè,"this, the, here",7
个,gè,"numerary adjunct, piece; single",3
们,men,adjunct pronoun indicate plural,5
来,lái,"come, coming; return, returning",7
上,shàng,"top; superior, highest; go up, send up",3
为,wèi,"do, handle, govern, act; be",4
和,hé,"harmony, peace; peaceful, calm",8
地,de,"earth; soil, ground; region",6
到,dào,"go to, arrive, been to",8
以,yǐ,"by means of; thereby, therefore; consider as; in order to",4
说,shuō,"speak, say, talk; scold, upbraid",9
时,shí,"time, season; era, age, period",7
要,yào,"necessary, essential; necessity",9
就,jiù,"just, simply; to come, go to; to approach, near",12
出,chū,"go out, send out; stand; produce",5
会,huì,"assemble, meet together; meeting",6
可,kě,"may, can, -able; possibly",5
也,yě,also; classical final particle of strong affirmation or identity,3
你,nǐ,"you, second person pronoun",7
对,duì,"correct, right; facing, opposed",5
生,shēng,"life, living, lifetime; birth",5
能,néng,"to be able; can, permitted to; ability",10
而,ér,and; and then; and yet; but,6
子,zi,"offspring, child; fruit, seed of; 1st terrestrial branch",3
那,nà,"that, that one, those",6
得,dé,"obtain, get, gain, acquire",11
于,yú,"in, on, at; go to; surname",3
着,zhe,"make move, take action",11
下,xià,"under, underneath, below; down; inferior; bring down",3
自,zì,"self, private, personal; from",6
之,zhī,"marks preceding phrase as modifier of following phrase; it, him her, them; go to",3
过,guò,"pass, pass through, go across",6
发,fā,"issue, dispatch, send out; hair",5
后,hòu,"queen, empress, sovereign; (simp. for ",6
作,zuò,"make; work; compose, write; act, perform",7
里,lǐ,unit of distance; village; lane,7
用,yòng,"use, employ, apply, operate; use",5
道,dào,"path, road, street; method, way",12
行,xíng,"go; walk; move, travel; circulate",6
所,suǒ,"place, location; numerary adjunct",8
然,rán,"yes, certainly; pledge, promise",12
家,jiā,"house, home, residence; family",10
种,zhǒng,"seed; race, breed; to plant",9
事,shì,"affair, matter, business; to serve; accident, incident",8
成,chéng,"completed, finished, fixed",6
方,fāng,"a square, rectangle; a region; local",4
多,duō,"much, many; more than, over",6
经,jīng,classic works; pass through,8
么,me,interrogative particle; repetition of a tune small; tender,3
去,qù,"go away, leave, depart",5
法,fǎ,"law, rule, regulation, statute; France, French",8
学,xué,"learning, knowledge; school",8
如,rú,"if, supposing; as if; like, as",6
都,dōu,"metropolis, capital; all, the whole; elegant, refined",10
同,tóng,"same, similar; together with",6
现,xiàn,"appear, manifest, become visible",8
当,dāng,"bear, accept, undertake; just",6
没,méi,"not, have not, none; drown, sink",7
动,dòng,"move, happen; movement, action",6
面,miàn,"face; surface; plane; side, dimension",9
起,qǐ,"rise, stand up; go up; begin",10
看,kàn,"look, see; examine, scrutinize",9
定,dìng,"decide, settle, fix",8
分,fēn,divide; small unit of time etc.,4
还,hái,"still, yet, also, besides",7
进,jìn,"advance, make progress, enter",7
好,hǎo,"good, excellent, fine; well",6
部,bù,"part, division, section",10
其,qí,"his, her, its, their; that",8
些,xiē,"little, few; rather, somewhat",8
主,zhǔ,"master, chief owner; host; lord",5
样,yàng,"shape, form, pattern, style",10
理,lǐ,"reason, logic; manage",11
前,qián,"in front, forward; preceding",9
开,kāi,"open; initiate, begin, start",4
但,dàn,"only; but, however, yet, still",7
因,yīn,"cause, reason; by; because (of)",6
只,zhǐ,"only, just, simply",5
从,cóng,"from, by, since, whence, through",4
想,xiǎng,"think, speculate, plan, consider",13
实,shí,"real, true; honest, sincere",8
日,rì,sun; day; daytime,4
军,jūn,"army, military; soldiers, troops",6
者,zhě,that which; he who; those who,8
意,yì,"thought, idea, opinion; think",13
无,wú,"negative, no, not; KangXi radical 71",4
力,lì,"power, capability, influence",2
它,tā,it; other,5
与,yǔ,"and; with; to; for; give, grant",3
长,zhǎng,long; length; excel in; leader,4
把,bǎ,"hold, take; guard; regard as",7
机,jī,desk; machine; moment,6
十,shí,"ten, tenth; complete; perfect",2
民,mín,"people, subjects, citizens",5
第,dì,"sequence, number; grade, degree",11
公,gōng,"fair, equitable; public; duke",4
此,cǐ,"this, these; in this case, then",6
已,yǐ,already; finished; stop,3
使,shǐ,"cause, send on a mission, order; envoy, messenger, ambassador",8
情,qíng,"feeling, sentiment, emotion",11
明,míng,"bright, light, brilliant; clear",8
性,xìng,"nature, character, sex",8
知,zhī,"know, perceive, comprehend",8
全,quán,"maintain, keep whole or intact",6
三,sān,three,3
又,yòu,"and, also, again, in addition",2
点,diǎn,"dot, speck, spot; point, degree",9
正,zhèng,"right, proper, correct",5
业,yè,"profession, business; GB radical 111",5
外,wài,"out, outside, external; foreign",5
将,jiāng,"will, going to, future; general",9
两,liǎng,"two, both, pair, couple; ounce",7
高,gāo,"high, tall; lofty, elevated",10
间,jiān,"midpoint, space; place, locality",7
由,yóu,"cause, reason; from",5
问,wèn,"ask about, inquire after",6
很,hěn,"very, quite, much",9
最,zuì,"most, extremely, exceedingly",12
重,zhòng,"heavy, weighty; double",9
物,wù,"thing, substance, creature",8
手,shǒu,hand,4
应,yīng,"should, ought to, must",7
战,zhàn,"war, fighting, battle",9
向,xiàng,"toward, direction, trend",6
头,tóu,"head; top; chief, first; boss",5
文,wén,"literature, culture, writing",4
体,tǐ,"body; group, class, body, unit; inferior",7
政,zhèng,"government, political affairs",9
美,měi,"beautiful, pretty; pleasing",9
相,xiāng,"mutual, reciprocal, each other",9
见,jiàn,"see, observe, behold; perceive",4
利,lì,"gains, advantage, profit, merit",7
什,shén,"file of ten soldiers; mixed, miscellaneous",4
二,èr,two; twice,2
产,chǎn,"give birth, bring forth, produce",6
或,huò,"or, either, else; perhaps, maybe",8
新,xīn,"new, recent, fresh, modern",13
己,jǐ,"self, oneself; personal, private; 6th heavenly stem",3
制,zhì,system; establish; overpower,8
身,shēn,"body; trunk, hull; rad. no. 158",7
果,guǒ,fruit; result,8
加,jiā,"add to, increase, augment",5
西,xī,"west(ern); westward, occident",6
斯,sī,"this, thus, such; to lop off; emphatic particle",12
月,yuè,moon; month; KangXi radical 74,4
话,huà,"speech, talk, language; dialect",8
合,hé,"combine, unite, join; gather",6
回,huí,"return, turn around; a time",6
特,tè,"special, unique, distinguished",10
代,dài,"replace, replacement (of person or generation); era, generation",5
内,nèi,inside,4
信,xìn,"trust, believe; letter",9
表,biǎo,"show, express, manifest, display",8
化,huà,"change, convert, reform; -ize",4
给,gěi,"give; by, for",9
了,le,to finish; particle of completed action,2
世,shì,generation; world; era,5
位,wèi,"throne; position, post; rank, status; seat",7
次,cì,"order, sequence; next",6
度,dù,"degree, system; manner; to consider",9
门,mén,"gate, door, entrance, opening",3
任,rèn,"trust to, rely on, appoint; to bear, duty, office; allow",6
常,cháng,"common, normal, frequent, regular",11
先,xiān,"first, former, previous",6
海,hǎi,"sea, ocean; maritime",10
通,tōng,"pass through, common, communicate",10
教,jiào,"teach, class",11
儿,ér,"son, child; KangXi radical 10",2
东,dōng,"east, eastern, eastward",5
声,shēng,"sound, voice, noise; tone; music",7
提,tí,hold in hand; lift in hand,12
立,lì,"stand; let stand; establish, set",5
及,jí,extend; reach; come up to; and,3
比,bǐ,"to compare, liken; comparison; than",4
员,yuán,"member; personnel, staff member",7
解,jiě,"loosen, unfasten, untie; explain",13
水,shuǐ,"water, liquid, lotion, juice",4
名,míng,"name, rank, title, position",6
真,zhēn,"real, actual, true, genuine",10
论,lùn,debate; discuss; discourse,6
处,chù,"place, locale; department",5
走,zǒu,"walk, go on foot; run; leave",7
义,yì,"right conduct, righteousness",3
各,gè,"each, individually, every, all",6
入,rù,"enter, come in(to), join",2
几,jǐ,small table,2
口,kǒu,"mouth; open end; entrance, gate",3
认,rèn,"recognize, know, understand",4
条,tiáo,"clause, condition; string, stripe",7
平,píng,"flat, level, even; peaceful",5
系,xì,"system; line, link, connection",7
气,qì,"steam, vapor; KangXi radical 84",4
题,tí,"forehead; title, headline; theme",15
活,huó,"live, exist, survive; lively",9
尔,ěr,"you; that, those; final particle",5
更,gèng,"more, still further, much more",7
别,bié,"separate, other; do not",7
打,dǎ,"strike, hit, beat; fight; attack",5
女,nǚ,"woman, girl; feminine; rad. 38",3
变,biàn,"change, transform, alter; rebel",8
四,sì,four,5
神,shén,"spirit, god, supernatural being",9
总,zǒng,"collect; overall, altogether",9
何,hé,"what, why, where, which, how",7
电,diàn,electricity; electric; lightning,5
数,shù,"number; several, count; fate",13
安,ān,"peaceful, tranquil, quiet",6
少,shǎo,"few, less, inadequate",4
报,bào,"report, tell, announce",7
才,cái,"talent, ability; just, only",3
结,jié,"knot, tie; join, connect",9
反,fǎn,"reverse, opposite, contrary, anti",4
受,shòu,"receive, accept, get; bear, stand",8
目,mù,"eye; look, see; division, topic",5
太,tài,"very, too, much; big; extreme",4
量,liàng,"measure, quantity, capacity",12
再,zài,"again, twice, re-",6
感,gǎn,"feel, perceive, emotion",13
建,jiàn,"build, establish, erect, found",8
务,wù,"affairs, business; must, should",5
做,zuò,"work, make; act",11
接,jiē,receive; continue; catch; connect,11
必,bì,"surely, most certainly; must",5
场,chǎng,"open space, field, market",6
件,jiàn,numerary adjunct for article; matter,6
计,jì,"plan, plot; strategem; scheme",4
管,guǎn,"pipe, tube, duct; woodwind music",14
期,qī,period of time; date; time limit,12
市,shì,"market, fair; city, town; trade",5
直,zhí,"straight, erect, vertical",8
德,dé,"ethics, morality, virtue",15
资,zī,property; wealth; capital,10
命,mìng,"life; destiny, fate, luck; an order, instruction",8
山,shān,"mountain, hill, peak",3
金,jīn,gold; metals in general; money,8
指,zhǐ,"finger, toe; point, indicate",9
克,kè,gram; overcome; transliteration,7
许,xǔ,"allow, permit; promise; betroth",6
统,tǒng,"govern, command, control; unite",9
区,qū,"area, district, region, ward",4
保,bǎo,"protect, safeguard, defend, care",9
至,zhì,"reach, arrive; extremely, very",6
队,duì,"team, group; army unit",4
形,xíng,"form, shape, appearance",7
社,shè,"god of the soil and altars to him; group of families; company, society",7
便,biàn,"convenience, ease; expedient",9
空,kōng,"empty, hollow, bare, deserted",8
决,jué,"decide, determine, judge",6
治,zhì,"govern, regulate, administer",8
展,zhǎn,"open, unfold; stretch, extend",10
马,mǎ,horse; surname; KangXi radical 187,3
科,kē,"section, department, science",9
司,sī,"take charge of, control, manage; officer",5
五,wǔ,five; surname,4
基,jī,"foundation, base",11
眼,yǎn,"eye; eyelet, hole, opening",11
书,shū,"book, letter, document; writings",4
非,fēi,"not, negative, non-; oppose",8
则,zé,"rule, law, regulation; grades",6
听,tīng,"hear; understand; obey, comply",7
白,bái,"white; pure, unblemished; bright",5
却,què,"still, but; decline; retreat",7
界,jiè,"boundary, limit; domain; society; the world",9
达,dá,"arrive at, reach; intelligent; smooth, slippery",6
光,guāng,"light, brilliant, shine; only",6
放,fàng,"put, release, free, liberate",8
强,qiáng,"strong, powerful, energetic",12
即,jí,"promptly, quickly, immediately",7
像,xiàng,"a picture, image, figure; to resemble",13
难,nán,"difficult, arduous, hard; unable",10
且,qiě,"moreover, also (post-subject); about to, will soon (pre-verb)",5
权,quán,"power, right, authority",6
思,sī,"think, consider, ponder; final particle",9
王,wáng,"king, ruler; royal; surname",4
象,xiàng,"elephant; ivory; figure, image",11
完,wán,"complete, finish, settle; whole",7
设,shè,build; establish; display,6
式,shì,"style, system, formula, rule",6
色,sè,"color, tint, hue, shade; form, body; beauty, desire for beauty",6
路,lù,"road, path, street; journey",13
记,jì,"record; keep in mind, remember",5
南,nán,south; southern part; southward,9
品,pǐn,"article, product, commodity",9
住,zhù,"reside, live at, dwell, lodge; stop",7
告,gào,"tell, announce, inform; accuse",7
类,lèi,"class, group, kind, category",9
求,qiú,"seek; demand, request; beseech",7
据,jù,"to occupy, take possession of; a base, position",11
程,chéng,"journey, trip; schedule, agenda",12
北,běi,north; northern; northward,5
边,biān,"edge, margin, side, border",5
死,sǐ,die; dead; death,6
张,zhāng,"stretch, extend, expand; sheet",7
该,gāi,"should, ought to, need to",8
交,jiāo,"mix; intersect; exchange, communicate; deliver",6
规,guī,"rules, regulations, customs, law",8
万,wàn,ten thousand; innumerable,3
取,qǔ,"take, receive, obtain; select",8
拉,lā,"pull, drag; seize, hold; lengthen",8
格,gé,"pattern, standard, form; style",10
望,wàng,"to look at, look forward; to hope, expect",11
觉,jué,to wake up from sleep; conscious,9
术,shù,"art, skill, special feat; method, technique",5
领,lǐng,"neck; collar; lead, guide",11
共,gòng,"together with, all, total; to share",6
确,què,"sure, certain; real, true",12
传,chuán,"summon; propagate, transmit",6
师,shī,"teacher, master, specialist",6
观,guān,"see, observe, view; appearance",6
清,qīng,"clear, pure, clean; peaceful",11
今,jīn,"now, today, modern era",4
切,qiè,"cut, mince, slice, carve",4
院,yuàn,"courtyard, yard, court; school",9
让,ràng,"allow, permit, yield, concede",5
识,shí,"recognize, understand, know",7
候,hòu,wait; expect; visit; greet,10
带,dài,"belt, girdle, band, strap, zone",9
导,dǎo,"direct, guide, lead, conduct",6
争,zhēng,"dispute, fight, contend, strive",6
运,yùn,run; simplified form of ,7
笑,xiào,"smile, laugh, giggle; snicker",10
飞,fēi,fly; go quickly; dart; high,3
风,fēng,"wind; air; manners, atmosphere",4
步,bù,"step, pace; walk, stroll",7
改,gǎi,"change, alter; improve, remodel",7
收,shōu,"gather together, collect; harvest",6
根,gēn,"root, base(d on); foundation",10
干,gàn,"oppose, offend; invade; dried",3
造,zào,"construct, build, make, begin; prepare",10
言,yán,"words, speech; speak, say",7
联,lián,"connect, join; associate, ally",12
持,chí,"sustain, support; hold, grasp",9
组,zǔ,"class; section, department",8
每,měi,"every, each",7
济,jì,"help, aid, relieve; ferry, cross",9
车,chē,"cart, vehicle; carry in cart",4
亲,qīn,"relatives, parents; intimate the hazel nut or filbert tree a thorny tree",9
极,jí,"extreme, utmost, furthest, final",7
林,lín,"forest, grove; surname",8
服,fú,"clothes; wear, dress",8
快,kuài,"rapid, quick, speedy, fast; soon",7
办,bàn,"manage, do, handle; deal with",4
议,yì,"consult, talk over, discuss",5
往,wǎng,"go, depart; past, formerly",8
元,yuán,first; dollar; origin; head,4
英,yīng,"petal, flower, leaf; brave, a hero; England, English",8
士,shì,"scholar, gentleman; soldier",3
证,zhèng,"prove, confirm, verify; proof",7
近,jìn,"near, close; approach; intimate",7
失,shī,"lose; make mistake, neglect",5
转,zhuǎn,"shift, move, turn",8
夫,fū,"man, male adult, husband; those",4
准,zhǔn,"approve, allow, permit; in accord",10
布,bù,"cotton cloth, textiles, linen",5
始,shǐ,"begin, start; then, only then",8
怎,zěn,what? why? how?,9
呢,ne,interrogative or emphatic final; (Cant.) this,8
存,cún,"exist, live, be; survive; remain",6
未,wèi,not yet; 8th terrestrial branch,5
远,yuǎn,"distant, remote, far; profound",7
叫,jiào,"cry, shout; hail, greet, call",5
台,tái,platform; unit; term of address,5
单,dān,"single, individual, only; lone",8
影,yǐng,"shadow; image, reflection; photograph",15
具,jù,"tool, implement; draw up, write",8
罗,luō,net for catching birds; gauze,8
字,zì,"letter, character, word",6
爱,ài,"love, be fond of, like",10
击,jī,"strike, hit, beat; attack, fight",5
流,liú,"flow, circulate, drift; class",10
备,bèi,"prepare, ready, perfect",8
兵,bīng,"soldier, troops",7
连,lián,"join, connect; continuous; even",7
调,diào,"transfer, move, change; tune",10
深,shēn,"deep; depth; far; very, extreme",11
商,shāng,"commerce, business, trade",11
算,suàn,"count, calculate, figure; plan",14
质,zhì,"matter, material, substance",8
团,tuán,"sphere, ball, circle; mass, lump",6
集,jí,"assemble, collect together",12
百,bǎi,"one hundred; numerous, many",6
需,xū,"need, require, must",14
价,jià,"price, value",6
花,huā,flower; blossoms,7
党,dǎng,"political party, gang, faction",10
华,huá,flowery; illustrious; Chinese,6
城,chéng,"castle; city, town; municipality",9
石,shí,"stone, rock, mineral; rad. 112",5
级,jí,"level, rank, class; grade",6
整,zhěng,"orderly, neat, tidy; whole",16
府,fǔ,prefecture; prefect; government,8
离,lí,rare beast; strange; elegant,10
况,kuàng,"condition, situation; furthermore",7
亚,yà,Asia; second,6
请,qǐng,"ask, request; invite; please",10
技,jì,"skill, ability, talent, ingenuity",7
际,jì,"border, boundary, juncture",7
约,yuē,"treaty, agreement, covenant",6
示,shì,"show, manifest; demonstrate",5
复,fù,return; repeat; repeatedly,9
病,bìng,"illness, sickness, disease",10
息,xī,"rest, put stop to, end, cease",10
究,jiū,"examine, investigate",7
线,xiàn,"line, thread, wire; clue",8
似,shì,"resemble, similar to; as if, seem",6
官,guān,"official, public servant",8
火,huǒ,"fire, flame; burn; anger, rage",4
断,duàn,"sever, cut off; interrupt",11
精,jīng,essence; semen; spirit,14
满,mǎn,"fill; full, satisfied",13
支,zhī,"disperse, pay; support; branch",4
视,shì,"look at, inspect, observe, see",8
消,xiāo,"vanish, die out; melt away",10
越,yuè,"exceed, go beyond; the more ...",12
器,qì,"receptacle, vessel; instrument",16
容,róng,"looks, appearance; figure, form",10
照,zhào,"shine, illumine, reflect",13
须,xū,"must, have to, necessary",9
九,jiǔ,nine,2
增,zēng,"increase, add to, augment",15
研,yán,"grind, rub; study, research",9
写,xiě,"write; draw, sketch; compose",5
称,chēng,"call; name, brand; address; say",10
企,qǐ,plan a project; stand on tiptoe,6
八,bā,"eight; all around, all sides",2
功,gōng,"achievement, merit, good result",5
吗,ma,final interrogative particle,6
包,bāo,"wrap, pack, bundle; package",5
片,piàn,"slice, splinter, strip; rad. 91",4
史,shǐ,"history, chronicle, annals",5
委,wěi,"appoint, send, commission",8
乎,hū,interrogative or exclamatory final particle,5
查,chá,"investigate, examine, seek into",9
轻,qīng,"light; easy, simple; gentle",9
易,yì,change; easy,8
早,zǎo,early; soon; morning,6
曾,céng,already; sign of past,12
除,chú,"eliminate, remove, except",9
农,nóng,"agriculture, farming; farmer",6
找,zhǎo,"search, seek, look for; find",7
装,zhuāng,"dress, clothes, attire; fill",12
广,guǎng,"wide, extensive, broad; rad. 53",3
显,xiǎn,"manifest, display; evident, clear",9
吧,ba,emphatic final particle,7
李,lǐ,plum; judge; surname,7
标,biāo,"mark, symbol, label, sign; stand the bole of a tree",9
谈,tán,talk; conversation; surname,10
吃,chī,"eat; drink; suffer, endure, bear",6
图,tú,"diagram; chart, map, picture",8
念,niàn,"think of, recall, study",8
六,liù,number six,4
引,yǐn,"to pull, draw out, attract; to stretch",4
历,lì,history; calendar,4
首,shǒu,"head; first; leader, chief; a poem",9
医,yī,"cure, heal; doctor, medical",7
局,jú,"bureau, office; circumstance",7
突,tū,"suddenly, abruptly, unexpectedly",9
专,zhuān,"monopolize, take sole possession",4
费,fèi,"expenses, expenditures, fee",9
号,hào,"mark, sign; symbol; number",5
尽,jǐn,"exhaust, use up; deplete",6
另,lìng,"another, separate, other",5
周,zhōu,Zhou dynasty; circumference,8
较,jiào,"compare; comparatively, more",10
注,zhù,"concentrate, focus, direct",8
语,yǔ,"language, words; saying, expression",9
仅,jǐn,"only, merely, solely, just",4
考,kǎo,"examine, test; investigate",6
落,luò,"fall, drop; net income, surplus",12
青,qīng,"blue, green, black; young",8
随,suí,"follow, listen to, submit to",11
选,xuǎn,"choose, select; elect; election",9
列,liè,"a line; to arrange in order, classify",6
武,wǔ,"military; martial, warlike",8
红,hóng,"red, vermillion; blush, flush",6
响,xiǎng,"make sound, make noise; sound",9
虽,suī,"although, even if",9
推,tuī,"push, expel; push forward",11
势,shì,"power, force; tendency",8
参,cān,"take part in, intervene; ginseng",8
希,xī,"rare; hope, expect, strive for",7
古,gǔ,"old, classic, ancient",5
众,zhòng,"multitude, crowd; masses, public",6
构,gòu,"frame, building, structure",8
房,fáng,"house, building; room",8
半,bàn,half,5
节,jié,"knot, node, joint; section",5
土,tǔ,"soil, earth; items made of earth",3
投,tóu,"throw, cast, fling, pitch; jump",7
某,mǒu,certain thing or person,9
案,àn,"table, bench; legal case",10
黑,hēi,"black; dark; evil, sinister",12
维,wéi,"maintain, preserve, safeguard",11
革,gé,"leather, animal hides; rad. 177",9
划,huà,to row or paddle boat; to scratch,6
敌,dí,"enemy, foe, rival; resist",10
致,zhì,"send, deliver, present; cause",10
陈,chén,"exhibit, display; plead; a surname",7
律,lǜ,"statute, principle, regulation",9
足,zú,"foot; attain, satisfy, enough",7
态,tài,"manner, bearing, attitude",8
护,hù,"protect, guard, defend, shelter",7
七,qī,seven,2
兴,xìng,"thrive, prosper, flourish",6
派,pài,"school of thought, sect, branch",9
孩,hái,"baby, child; children",9
验,yàn,"test, examine, inspect; verify",10
